{
  "schemaVersion": 1,
  "runId": "iphone-15-plus-ios27.0-24A437-tinyllama-1-1b-1t-openorca-q4_0-20261005t011056z-liso",
  "capturedAt": "2026-10-05T01:10:56Z",
  "matrixVersion": "v1",
  "source": "app",
  "appVersion": "1.0 (1)",
  "device": {
    "identifier": "iPhone15,5",
    "model": "iPhone 15 Plus",
    "ramGB": 6,
    "soc": "A16 Bionic"
  },
  "os": {
    "build": "24A437",
    "name": "iOS",
    "version": "27.0"
  },
  "backend": {
    "buildFlags": "build-xcframework.sh; GGML_METAL=ON; n_ctx=4096; batch=2048",
    "commit": "95ef7fc16054e63b427a3ef00188e055ef7586d8",
    "name": "llama.cpp-metal",
    "version": "b1 (source build)"
  },
  "model": {
    "fileSha256": "bd07d1c53b833d422272259b17b393270b8f81c937d14332dfa044fe1b349884",
    "id": "TinyLlama-1.1B-1T-OpenOrca",
    "params": 1.100048384,
    "quant": "Q4_0",
    "tensorBytes": 635990016
  },
  "regime": {
    "promptTokens": 2048,
    "generateTokens": 128,
    "label": "LISO"
  },
  "conditions": {
    "airplaneMode": true,
    "batteryEndPct": 60,
    "batteryStartPct": 60,
    "charging": false,
    "lowPowerMode": false
  },
  "repeats": [
    {
      "decodeTokensPerSec": 63.90748991413117,
      "index": 0,
      "peakResidentMB": 852.6875,
      "prefillTokensPerSec": 549.3412419860384,
      "thermalStateEnd": "fair",
      "thermalStateStart": "fair",
      "ttftMs": 3728.101667
    },
    {
      "decodeTokensPerSec": 63.33623492789473,
      "index": 1,
      "peakResidentMB": 852.515625,
      "prefillTokensPerSec": 534.0033406498048,
      "thermalStateEnd": "fair",
      "thermalStateStart": "fair",
      "ttftMs": 3835.1820000000002
    },
    {
      "decodeTokensPerSec": 62.20207997924005,
      "index": 2,
      "peakResidentMB": 852.671875,
      "prefillTokensPerSec": 513.946707036016,
      "thermalStateEnd": "serious",
      "thermalStateStart": "serious",
      "ttftMs": 3984.848958
    },
    {
      "decodeTokensPerSec": 61.13395243002387,
      "index": 3,
      "peakResidentMB": 852.78125,
      "prefillTokensPerSec": 475.2557869169906,
      "thermalStateEnd": "serious",
      "thermalStateStart": "serious",
      "ttftMs": 4309.258417
    },
    {
      "decodeTokensPerSec": 59.17053539729493,
      "index": 4,
      "peakResidentMB": 852.859375,
      "prefillTokensPerSec": 429.2934281894334,
      "thermalStateEnd": "serious",
      "thermalStateStart": "serious",
      "ttftMs": 4770.62975
    }
  ],
  "valid": true,
  "notes": "Second phone (iPhone 15 Plus / A16), captured with the PocketRoofline iOS app 1.0 (1); raw capture kept unmodified in results/captures/. Single session, back-to-back SISO -> LISO -> SILO, one unrecorded warmup, ~3 s between repeats; no usable network path at any sample (airplane mode), unplugged, Low Power Mode off, battery 60% -> 60%. THREE CAVEATS apply to every figure from this session. (1) WARM START, a METHODOLOGY 5 deviation as in the iPhone 13 session: thermalState was 'fair' at the start; the 10-minute cooldown to 'nominal' was not achieved. (2) APP CAPTURE: the app redraws a live decode chart during each repeat (a new point every 16 generated tokens, inside the timed decode loop); the iPhone 13 harness drew nothing while a repeat ran, so GPU contention from the UI is a possible confound in any comparison between the two phones. (3) UNEXPLAINED SILO STEP: decode fell from 59.17 t/s (last LISO repeat) to 29.69 t/s (first SILO repeat, begun ~3 s later), thermalState 'serious' on both sides, while prefill rose 429.3 -> 465.0 t/s (2048- vs 128-token prompts). That is not a plain thermal decline, and nothing recorded here explains it. A cold-start run with SILO first is owed; until then no peak-to-sustained percentage is quoted for this device, and its SILO figures are not a sustained-throughput estimate. Bandwidth ceiling for this phone is measured, not published: Headroom Metal STREAM triad, median of four probes at 01:05:26-01:05:38Z (this capture is stamped 01:10:56Z, at the end of the run); raw reports in results/bandwidth/."
}
