{
  "schemaVersion": 1,
  "runId": "iphone13-a15-ios26.6.1-23G83-llamacpp-tinyllama1.1b-q4_0-siso",
  "capturedAt": "2026-09-03T19:00:36Z",
  "matrixVersion": "v1",
  "device": {
    "model": "iPhone 13",
    "soc": "A15 Bionic",
    "ramGB": 4,
    "identifier": "iPhone14,5"
  },
  "os": {
    "name": "iOS",
    "version": "26.6.1",
    "build": "23G83"
  },
  "backend": {
    "name": "llama.cpp-metal",
    "version": "b1 (source build)",
    "commit": "95ef7fc16054e63b427a3ef00188e055ef7586d8",
    "buildFlags": "build-xcframework.sh ios-device; GGML_METAL=ON; n_ctx=4096; batch=2048"
  },
  "model": {
    "id": "TinyLlama-1.1B-1T-OpenOrca",
    "params": 1.1,
    "quant": "Q4_0",
    "fileSha256": "bd07d1c53b833d422272259b17b393270b8f81c937d14332dfa044fe1b349884",
    "config": {
      "attention": "MHA"
    },
    "tensorBytes": 635990016
  },
  "regime": {
    "promptTokens": 128,
    "generateTokens": 128,
    "label": "SISO"
  },
  "conditions": {
    "airplaneMode": true,
    "charging": false,
    "cooldownSeconds": 0
  },
  "repeats": [
    {
      "index": 0,
      "prefillTokensPerSec": 527.949,
      "decodeTokensPerSec": 42.597,
      "ttftMs": 242.448,
      "peakResidentMB": 777.2,
      "thermalStateStart": "fair",
      "thermalStateEnd": "fair"
    },
    {
      "index": 1,
      "prefillTokensPerSec": 508.832,
      "decodeTokensPerSec": 42.439,
      "ttftMs": 251.557,
      "peakResidentMB": 774.8,
      "thermalStateStart": "fair",
      "thermalStateEnd": "fair"
    },
    {
      "index": 2,
      "prefillTokensPerSec": 486.717,
      "decodeTokensPerSec": 42.575,
      "ttftMs": 262.986,
      "peakResidentMB": 774.1,
      "thermalStateStart": "fair",
      "thermalStateEnd": "fair"
    },
    {
      "index": 3,
      "prefillTokensPerSec": 507.518,
      "decodeTokensPerSec": 43.202,
      "ttftMs": 252.208,
      "peakResidentMB": 770.7,
      "thermalStateStart": "fair",
      "thermalStateEnd": "fair"
    },
    {
      "index": 4,
      "prefillTokensPerSec": 489.185,
      "decodeTokensPerSec": 43.193,
      "ttftMs": 261.66,
      "peakResidentMB": 765.3,
      "thermalStateStart": "fair",
      "thermalStateEnd": "fair"
    }
  ],
  "valid": true,
  "notes": "FIRST PocketRoofline measurement on smartphone-class silicon (iPhone 13 / A15). Radios fully off (airplane mode, Wi-Fi and Bluetooth disabled), unplugged, app in foreground, single session run back-to-back SISO -> LISO -> SILO with one unrecorded warmup and ~3 s between repeats. PROTOCOL DEVIATION, recorded per METHODOLOGY 5: the device began at thermalState 'fair', not 'nominal' (the 10-minute ambient cooldown was not achieved before the session), and never returned to nominal. These are therefore warm-start figures. They are published as measured; the cold-start protocol run is a separate future session and will not overwrite this one. Stable regime and the control for the whole session: decode sd 0.37 t/s (0.9% CV) across 5 repeats, 95% CI [42.53, 43.08] t/s. Because decode is this reproducible here, the decline measured under sustained load in SILO cannot be attributed to measurement noise."
}
