{
  "schemaVersion": 1,
  "runId": "m1-macos27-26A5421a-llamacpp95ef7fc-qwen2.5-0.5b-q4km-siso-001",
  "capturedAt": "2026-09-03T17:32:35Z",
  "matrixVersion": "v1",
  "device": {
    "model": "MacBook Pro (M1, 2020)",
    "soc": "Apple M1",
    "ramGB": 16,
    "identifier": "MacBookPro17,1"
  },
  "os": {
    "name": "macOS",
    "version": "27.0",
    "build": "26A5421a"
  },
  "backend": {
    "name": "llama.cpp-metal",
    "version": "b1",
    "commit": "95ef7fc16054e63b427a3ef00188e055ef7586d8",
    "buildFlags": "-DGGML_METAL=ON -DLLAMA_CURL=OFF"
  },
  "model": {
    "id": "Qwen2.5-0.5B-Instruct",
    "params": 0.494,
    "quant": "Q4_K_M",
    "fileSha256": "6eb923e7d26e9cea28811e1a8e852009b21242fb157b26149d3b188f3a8c8653",
    "config": {
      "attention": "GQA"
    }
  },
  "regime": {
    "promptTokens": 128,
    "generateTokens": 128,
    "label": "SISO"
  },
  "conditions": {
    "charging": true,
    "cooldownSeconds": 0
  },
  "repeats": [
    { "index": 0, "prefillTokensPerSec": 1657.34, "decodeTokensPerSec": 95.0835, "ttftMs": 77.23, "thermalStateStart": "nominal", "thermalStateEnd": "nominal" },
    { "index": 1, "prefillTokensPerSec": 1690.06, "decodeTokensPerSec": 93.372, "ttftMs": 75.74, "thermalStateStart": "nominal", "thermalStateEnd": "nominal" },
    { "index": 2, "prefillTokensPerSec": 1615.39, "decodeTokensPerSec": 93.7777, "ttftMs": 79.24, "thermalStateStart": "nominal", "thermalStateEnd": "nominal" },
    { "index": 3, "prefillTokensPerSec": 1609.5, "decodeTokensPerSec": 76.7093, "ttftMs": 79.53, "thermalStateStart": "nominal", "thermalStateEnd": "nominal" },
    { "index": 4, "prefillTokensPerSec": 1696.47, "decodeTokensPerSec": 48.0914, "ttftMs": 75.45, "thermalStateStart": "nominal", "thermalStateEnd": "nominal", "valid": false, "invalidReason": "decode throughput collapsed to ~50% of the other four repeats (48 vs ~95 tok/s) — background scheduling contention on a non-quiesced dev machine; excluded from the decode aggregate, retained here in full." }
  ],
  "derived": {
    "decodeMedian": 93.4,
    "ciMethod": "reported-with-caveat",
    "oiMethod": "not-yet-computed"
  },
  "valid": true,
  "notes": "FIRST PocketRoofline measurement — M1 calibration anchor (not the M1 Pro used by RooflineBench; a lower same-family tier, reported as such). Run on macOS 27.0 dev machine, NOT quiescent and on charger, so this is a smoke-test of the pipeline and schema, not a steady-state figure: cooldown protocol (METHODOLOGY §5) was not applied and repeat 4's decode collapse reflects that. Prefill is stable (1653.8 avg, stddev 40.6). Decode across the 4 valid repeats: ~93 tok/s. thermalState here is asserted nominal (macOS does not expose per-run ProcessInfo.thermalState via llama-bench; the on-device iOS harness records it properly). ttftMs is the mean prefill wall time as a proxy. Purpose met: schema exercised end-to-end against real llama.cpp-Metal output before the device work begins."
}
